[
  {
    "id": "LAW-TRUTH-001",
    "title": "Truth Boundary",
    "tier": 0,
    "constitutional": true,
    "mandatory": true,
    "domains": ["*"],
    "modes": ["*"],
    "riskLevels": ["*"],
    "failureMode": "A proposal or runtime claim exceeds available evidence.",
    "protectedValue": "Truth and evidence integrity",
    "controls": ["Label implemented, tested, proposed, blocked, and unknown states."],
    "requiredEvidence": ["truth_boundary_recorded"],
    "mergeKey": "TRUTH_AND_CLAIMS",
    "burden": 1,
    "protection": 5,
    "source": "APEX Core OS"
  },
  {
    "id": "LAW-CLAIMS-002",
    "title": "No Proof, No Promotion",
    "tier": 1,
    "mandatory": true,
    "domains": ["*"],
    "modes": ["BUILD", "PILOT", "PRODUCTION", "HIGH_STAKES"],
    "riskLevels": ["*"],
    "failureMode": "Unverified output is promoted as operational capability.",
    "protectedValue": "Evidence-correct promotion",
    "controls": ["Require a linked evidence receipt before promotion."],
    "requiredEvidence": ["promotion_evidence_linked"],
    "mergeKey": "TRUTH_AND_CLAIMS",
    "burden": 2,
    "protection": 5,
    "source": "APEX Core OS"
  },
  {
    "id": "LAW-PROTOTYPE-003",
    "title": "Reversible Prototype Stop Conditions",
    "tier": 3,
    "domains": ["SOFTWARE"],
    "modes": ["PROTOTYPE"],
    "riskLevels": ["LOW", "MODERATE"],
    "failureMode": "A prototype consumes uncontrolled resources or cannot be rolled back.",
    "protectedValue": "Bounded experimentation",
    "controls": ["Declare prototype scope and stop conditions."],
    "requiredEvidence": [],
    "mergeKey": "PROTOTYPE_BOUNDARY",
    "burden": 1,
    "protection": 3,
    "source": "OCODE"
  },
  {
    "id": "LAW-PRODUCTION-004",
    "title": "Production Recovery",
    "tier": 2,
    "domains": ["SOFTWARE"],
    "modes": ["PRODUCTION", "HIGH_STAKES"],
    "riskLevels": ["HIGH", "CRITICAL", "UNKNOWN"],
    "failureMode": "Production service cannot be restored after failure.",
    "protectedValue": "Recoverability",
    "controls": ["Verify backup restore and rollback."],
    "requiredEvidence": ["restore_test_passed"],
    "mergeKey": "PRODUCTION_RECOVERY",
    "burden": 4,
    "protection": 6,
    "source": "Secure Storage Runtime"
  },
  {
    "id": "LAW-QUALIFIED-005",
    "title": "Qualified Authority",
    "tier": 0,
    "constitutional": true,
    "mandatory": true,
    "domains": ["MEDICAL", "LEGAL", "FINANCIAL", "ENGINEERING"],
    "modes": ["HIGH_STAKES", "PRODUCTION"],
    "riskLevels": ["HIGH", "CRITICAL", "UNKNOWN"],
    "failureMode": "A high-stakes conclusion is acted on without qualified review.",
    "protectedValue": "Human safety and professional accountability",
    "controls": ["Require qualified professional review before execution."],
    "requiredEvidence": ["qualified_review_complete"],
    "mergeKey": "QUALIFIED_AUTHORITY",
    "burden": 5,
    "protection": 10,
    "source": "APEX Core OS"
  },
  {
    "id": "LAW-ADVISORY-006",
    "title": "Use concise screen labels",
    "tier": 5,
    "domains": ["SOFTWARE"],
    "modes": ["PROTOTYPE", "BUILD"],
    "riskLevels": ["*"],
    "failureMode": "The user interface becomes harder to understand.",
    "protectedValue": "Usability",
    "controls": ["Prefer concise labels where meaning remains clear."],
    "mergeKey": "UI_CLARITY",
    "burden": 1,
    "protection": 1,
    "source": "OCODE UX guidance"
  }
]
